{
  "schema_version": 1,
  "feature_spec_version": "anchored-char-v1",
  "kind": "fixture",
  "model_version": "fabricated-parity-only-v1",
  "positive_label": "JA_ROMAN",
  "vocabulary": [
    "[\"char\",-1,[\"BOS\"]]",
    "[\"char\",-1,[\"CHAR\",\" \"]]",
    "[\"char\",-1,[\"CHAR\",\".\"]]",
    "[\"char\",-1,[\"CHAR\",\"/\"]]",
    "[\"char\",-1,[\"CHAR\",\"a\"]]",
    "[\"char\",-1,[\"CHAR\",\"c\"]]",
    "[\"char\",-1,[\"CHAR\",\"d\"]]",
    "[\"char\",-1,[\"CHAR\",\"e\"]]",
    "[\"char\",-1,[\"CHAR\",\"h\"]]",
    "[\"char\",-1,[\"CHAR\",\"i\"]]",
    "[\"char\",-1,[\"CHAR\",\"k\"]]",
    "[\"char\",-1,[\"CHAR\",\"m\"]]",
    "[\"char\",-1,[\"CHAR\",\"n\"]]",
    "[\"char\",-1,[\"CHAR\",\"o\"]]",
    "[\"char\",-1,[\"CHAR\",\"p\"]]",
    "[\"char\",-1,[\"CHAR\",\"r\"]]",
    "[\"char\",-1,[\"CHAR\",\"s\"]]",
    "[\"char\",-1,[\"CHAR\",\"t\"]]",
    "[\"char\",-1,[\"CHAR\",\"u\"]]",
    "[\"char\",-1,[\"CHAR\",\"w\"]]",
    "[\"char\",-1,[\"CHAR\",\"y\"]]",
    "[\"char\",-2,[\"BOS\"]]",
    "[\"char\",-2,[\"CHAR\",\" \"]]",
    "[\"char\",-2,[\"CHAR\",\".\"]]",
    "[\"char\",-2,[\"CHAR\",\"/\"]]",
    "[\"char\",-2,[\"CHAR\",\"0\"]]",
    "[\"char\",-2,[\"CHAR\",\"a\"]]",
    "[\"char\",-2,[\"CHAR\",\"c\"]]",
    "[\"char\",-2,[\"CHAR\",\"d\"]]",
    "[\"char\",-2,[\"CHAR\",\"e\"]]",
    "[\"char\",-2,[\"CHAR\",\"i\"]]",
    "[\"char\",-2,[\"CHAR\",\"k\"]]",
    "[\"char\",-2,[\"CHAR\",\"l\"]]",
    "[\"char\",-2,[\"CHAR\",\"m\"]]",
    "[\"char\",-2,[\"CHAR\",\"n\"]]",
    "[\"char\",-2,[\"CHAR\",\"o\"]]",
    "[\"char\",-2,[\"CHAR\",\"p\"]]",
    "[\"char\",-2,[\"CHAR\",\"r\"]]",
    "[\"char\",-2,[\"CHAR\",\"s\"]]",
    "[\"char\",-2,[\"CHAR\",\"t\"]]",
    "[\"char\",-2,[\"CHAR\",\"u\"]]",
    "[\"char\",-2,[\"CHAR\",\"w\"]]",
    "[\"char\",-3,[\"BOS\"]]",
    "[\"char\",-3,[\"CHAR\",\" \"]]",
    "[\"char\",-3,[\"CHAR\",\"/\"]]",
    "[\"char\",-3,[\"CHAR\",\":\"]]",
    "[\"char\",-3,[\"CHAR\",\"a\"]]",
    "[\"char\",-3,[\"CHAR\",\"c\"]]",
    "[\"char\",-3,[\"CHAR\",\"d\"]]",
    "[\"char\",-3,[\"CHAR\",\"e\"]]",
    "[\"char\",-3,[\"CHAR\",\"f\"]]",
    "[\"char\",-3,[\"CHAR\",\"i\"]]",
    "[\"char\",-3,[\"CHAR\",\"k\"]]",
    "[\"char\",-3,[\"CHAR\",\"l\"]]",
    "[\"char\",-3,[\"CHAR\",\"m\"]]",
    "[\"char\",-3,[\"CHAR\",\"n\"]]",
    "[\"char\",-3,[\"CHAR\",\"o\"]]",
    "[\"char\",-3,[\"CHAR\",\"p\"]]",
    "[\"char\",-3,[\"CHAR\",\"r\"]]",
    "[\"char\",-3,[\"CHAR\",\"s\"]]",
    "[\"char\",-3,[\"CHAR\",\"t\"]]",
    "[\"char\",-3,[\"CHAR\",\"u\"]]",
    "[\"char\",-3,[\"CHAR\",\"w\"]]",
    "[\"char\",-3,[\"CHAR\",\"y\"]]",
    "[\"char\",-4,[\"BOS\"]]",
    "[\"char\",-4,[\"CHAR\",\" \"]]",
    "[\"char\",-4,[\"CHAR\",\".\"]]",
    "[\"char\",-4,[\"CHAR\",\":\"]]",
    "[\"char\",-4,[\"CHAR\",\"\\\\\"]]",
    "[\"char\",-4,[\"CHAR\",\"_\"]]",
    "[\"char\",-4,[\"CHAR\",\"a\"]]",
    "[\"char\",-4,[\"CHAR\",\"e\"]]",
    "[\"char\",-4,[\"CHAR\",\"g\"]]",
    "[\"char\",-4,[\"CHAR\",\"h\"]]",
    "[\"char\",-4,[\"CHAR\",\"i\"]]",
    "[\"char\",-4,[\"CHAR\",\"k\"]]",
    "[\"char\",-4,[\"CHAR\",\"l\"]]",
    "[\"char\",-4,[\"CHAR\",\"m\"]]",
    "[\"char\",-4,[\"CHAR\",\"o\"]]",
    "[\"char\",-4,[\"CHAR\",\"p\"]]",
    "[\"char\",-4,[\"CHAR\",\"r\"]]",
    "[\"char\",-4,[\"CHAR\",\"s\"]]",
    "[\"char\",-4,[\"CHAR\",\"t\"]]",
    "[\"char\",-4,[\"CHAR\",\"u\"]]",
    "[\"char\",-4,[\"CHAR\",\"w\"]]",
    "[\"char\",-4,[\"CHAR\",\"x\"]]",
    "[\"char\",-5,[\"BOS\"]]",
    "[\"char\",-5,[\"CHAR\",\" \"]]",
    "[\"char\",-5,[\"CHAR\",\"/\"]]",
    "[\"char\",-5,[\"CHAR\",\"a\"]]",
    "[\"char\",-5,[\"CHAR\",\"e\"]]",
    "[\"char\",-5,[\"CHAR\",\"g\"]]",
    "[\"char\",-5,[\"CHAR\",\"h\"]]",
    "[\"char\",-5,[\"CHAR\",\"i\"]]",
    "[\"char\",-5,[\"CHAR\",\"l\"]]",
    "[\"char\",-5,[\"CHAR\",\"m\"]]",
    "[\"char\",-5,[\"CHAR\",\"n\"]]",
    "[\"char\",-5,[\"CHAR\",\"o\"]]",
    "[\"char\",-5,[\"CHAR\",\"p\"]]",
    "[\"char\",-5,[\"CHAR\",\"s\"]]",
    "[\"char\",-5,[\"CHAR\",\"t\"]]",
    "[\"char\",-5,[\"CHAR\",\"w\"]]",
    "[\"char\",-6,[\"BOS\"]]",
    "[\"char\",-6,[\"CHAR\",\"/\"]]",
    "[\"char\",-6,[\"CHAR\",\"a\"]]",
    "[\"char\",-6,[\"CHAR\",\"c\"]]",
    "[\"char\",-6,[\"CHAR\",\"e\"]]",
    "[\"char\",-6,[\"CHAR\",\"i\"]]",
    "[\"char\",-6,[\"CHAR\",\"m\"]]",
    "[\"char\",-6,[\"CHAR\",\"n\"]]",
    "[\"char\",-6,[\"CHAR\",\"o\"]]",
    "[\"char\",-6,[\"CHAR\",\"p\"]]",
    "[\"char\",-6,[\"CHAR\",\"r\"]]",
    "[\"char\",-6,[\"CHAR\",\"s\"]]",
    "[\"char\",-6,[\"CHAR\",\"t\"]]",
    "[\"char\",-6,[\"CHAR\",\"y\"]]",
    "[\"char\",-7,[\"BOS\"]]",
    "[\"char\",-7,[\"CHAR\",\" \"]]",
    "[\"char\",-7,[\"CHAR\",\".\"]]",
    "[\"char\",-7,[\"CHAR\",\"/\"]]",
    "[\"char\",-7,[\"CHAR\",\"a\"]]",
    "[\"char\",-7,[\"CHAR\",\"c\"]]",
    "[\"char\",-7,[\"CHAR\",\"e\"]]",
    "[\"char\",-7,[\"CHAR\",\"f\"]]",
    "[\"char\",-7,[\"CHAR\",\"i\"]]",
    "[\"char\",-7,[\"CHAR\",\"m\"]]",
    "[\"char\",-7,[\"CHAR\",\"p\"]]",
    "[\"char\",-7,[\"CHAR\",\"r\"]]",
    "[\"char\",-7,[\"CHAR\",\"s\"]]",
    "[\"char\",-7,[\"CHAR\",\"t\"]]",
    "[\"char\",-7,[\"CHAR\",\"u\"]]",
    "[\"char\",-7,[\"CHAR\",\"y\"]]",
    "[\"char\",-8,[\"BOS\"]]",
    "[\"char\",-8,[\"CHAR\",\":\"]]",
    "[\"char\",-8,[\"CHAR\",\"a\"]]",
    "[\"char\",-8,[\"CHAR\",\"d\"]]",
    "[\"char\",-8,[\"CHAR\",\"e\"]]",
    "[\"char\",-8,[\"CHAR\",\"h\"]]",
    "[\"char\",-8,[\"CHAR\",\"i\"]]",
    "[\"char\",-8,[\"CHAR\",\"o\"]]",
    "[\"char\",-8,[\"CHAR\",\"p\"]]",
    "[\"char\",-8,[\"CHAR\",\"s\"]]",
    "[\"char\",-8,[\"CHAR\",\"t\"]]",
    "[\"char\",-8,[\"CHAR\",\"u\"]]",
    "[\"char\",-8,[\"CHAR\",\"x\"]]",
    "[\"char\",0,[\"CHAR\",\" \"]]",
    "[\"char\",0,[\"CHAR\",\".\"]]",
    "[\"char\",0,[\"CHAR\",\"2\"]]",
    "[\"char\",0,[\"CHAR\",\":\"]]",
    "[\"char\",0,[\"CHAR\",\"\\\\\"]]",
    "[\"char\",0,[\"CHAR\",\"a\"]]",
    "[\"char\",0,[\"CHAR\",\"e\"]]",
    "[\"char\",0,[\"CHAR\",\"f\"]]",
    "[\"char\",0,[\"CHAR\",\"g\"]]",
    "[\"char\",0,[\"CHAR\",\"h\"]]",
    "[\"char\",0,[\"CHAR\",\"i\"]]",
    "[\"char\",0,[\"CHAR\",\"k\"]]",
    "[\"char\",0,[\"CHAR\",\"l\"]]",
    "[\"char\",0,[\"CHAR\",\"m\"]]",
    "[\"char\",0,[\"CHAR\",\"n\"]]",
    "[\"char\",0,[\"CHAR\",\"o\"]]",
    "[\"char\",0,[\"CHAR\",\"p\"]]",
    "[\"char\",0,[\"CHAR\",\"r\"]]",
    "[\"char\",0,[\"CHAR\",\"s\"]]",
    "[\"char\",0,[\"CHAR\",\"t\"]]",
    "[\"char\",0,[\"CHAR\",\"u\"]]",
    "[\"char\",0,[\"CHAR\",\"w\"]]",
    "[\"char\",0,[\"CHAR\",\"x\"]]",
    "[\"char\",1,[\"CHAR\",\" \"]]",
    "[\"char\",1,[\"CHAR\",\".\"]]",
    "[\"char\",1,[\"CHAR\",\"/\"]]",
    "[\"char\",1,[\"CHAR\",\":\"]]",
    "[\"char\",1,[\"CHAR\",\"a\"]]",
    "[\"char\",1,[\"CHAR\",\"c\"]]",
    "[\"char\",1,[\"CHAR\",\"d\"]]",
    "[\"char\",1,[\"CHAR\",\"e\"]]",
    "[\"char\",1,[\"CHAR\",\"i\"]]",
    "[\"char\",1,[\"CHAR\",\"k\"]]",
    "[\"char\",1,[\"CHAR\",\"l\"]]",
    "[\"char\",1,[\"CHAR\",\"m\"]]",
    "[\"char\",1,[\"CHAR\",\"n\"]]",
    "[\"char\",1,[\"CHAR\",\"o\"]]",
    "[\"char\",1,[\"CHAR\",\"p\"]]",
    "[\"char\",1,[\"CHAR\",\"r\"]]",
    "[\"char\",1,[\"CHAR\",\"s\"]]",
    "[\"char\",1,[\"CHAR\",\"t\"]]",
    "[\"char\",1,[\"CHAR\",\"u\"]]",
    "[\"char\",1,[\"CHAR\",\"w\"]]",
    "[\"char\",1,[\"CHAR\",\"y\"]]",
    "[\"char\",1,[\"EOS\"]]",
    "[\"char\",2,[\"CHAR\",\" \"]]",
    "[\"char\",2,[\"CHAR\",\".\"]]",
    "[\"char\",2,[\"CHAR\",\"/\"]]",
    "[\"char\",2,[\"CHAR\",\"0\"]]",
    "[\"char\",2,[\"CHAR\",\"3\"]]",
    "[\"char\",2,[\"CHAR\",\"a\"]]",
    "[\"char\",2,[\"CHAR\",\"c\"]]",
    "[\"char\",2,[\"CHAR\",\"d\"]]",
    "[\"char\",2,[\"CHAR\",\"e\"]]",
    "[\"char\",2,[\"CHAR\",\"i\"]]",
    "[\"char\",2,[\"CHAR\",\"k\"]]",
    "[\"char\",2,[\"CHAR\",\"l\"]]",
    "[\"char\",2,[\"CHAR\",\"m\"]]",
    "[\"char\",2,[\"CHAR\",\"n\"]]",
    "[\"char\",2,[\"CHAR\",\"o\"]]",
    "[\"char\",2,[\"CHAR\",\"p\"]]",
    "[\"char\",2,[\"CHAR\",\"r\"]]",
    "[\"char\",2,[\"CHAR\",\"s\"]]",
    "[\"char\",2,[\"CHAR\",\"t\"]]",
    "[\"char\",2,[\"CHAR\",\"u\"]]",
    "[\"char\",2,[\"CHAR\",\"w\"]]",
    "[\"char\",2,[\"EOS\"]]",
    "[\"char\",3,[\"CHAR\",\" \"]]",
    "[\"char\",3,[\"CHAR\",\".\"]]",
    "[\"char\",3,[\"CHAR\",\"/\"]]",
    "[\"char\",3,[\"CHAR\",\"a\"]]",
    "[\"char\",3,[\"CHAR\",\"c\"]]",
    "[\"char\",3,[\"CHAR\",\"d\"]]",
    "[\"char\",3,[\"CHAR\",\"e\"]]",
    "[\"char\",3,[\"CHAR\",\"h\"]]",
    "[\"char\",3,[\"CHAR\",\"i\"]]",
    "[\"char\",3,[\"CHAR\",\"k\"]]",
    "[\"char\",3,[\"CHAR\",\"m\"]]",
    "[\"char\",3,[\"CHAR\",\"n\"]]",
    "[\"char\",3,[\"CHAR\",\"o\"]]",
    "[\"char\",3,[\"CHAR\",\"p\"]]",
    "[\"char\",3,[\"CHAR\",\"r\"]]",
    "[\"char\",3,[\"CHAR\",\"s\"]]",
    "[\"char\",3,[\"CHAR\",\"t\"]]",
    "[\"char\",3,[\"CHAR\",\"u\"]]",
    "[\"char\",3,[\"CHAR\",\"w\"]]",
    "[\"char\",3,[\"EOS\"]]",
    "[\"char\",4,[\"CHAR\",\".\"]]",
    "[\"char\",4,[\"CHAR\",\"2\"]]",
    "[\"char\",4,[\"CHAR\",\":\"]]",
    "[\"char\",4,[\"CHAR\",\"a\"]]",
    "[\"char\",4,[\"CHAR\",\"e\"]]",
    "[\"char\",4,[\"CHAR\",\"g\"]]",
    "[\"char\",4,[\"CHAR\",\"h\"]]",
    "[\"char\",4,[\"CHAR\",\"i\"]]",
    "[\"char\",4,[\"CHAR\",\"k\"]]",
    "[\"char\",4,[\"CHAR\",\"l\"]]",
    "[\"char\",4,[\"CHAR\",\"m\"]]",
    "[\"char\",4,[\"CHAR\",\"n\"]]",
    "[\"char\",4,[\"CHAR\",\"o\"]]",
    "[\"char\",4,[\"CHAR\",\"p\"]]",
    "[\"char\",4,[\"CHAR\",\"r\"]]",
    "[\"char\",4,[\"CHAR\",\"s\"]]",
    "[\"char\",4,[\"CHAR\",\"t\"]]",
    "[\"char\",4,[\"CHAR\",\"u\"]]",
    "[\"char\",4,[\"CHAR\",\"w\"]]",
    "[\"char\",4,[\"CHAR\",\"x\"]]",
    "[\"char\",4,[\"EOS\"]]",
    "[\"char\",5,[\"CHAR\",\" \"]]",
    "[\"char\",5,[\"CHAR\",\"/\"]]",
    "[\"char\",5,[\"CHAR\",\"_\"]]",
    "[\"char\",5,[\"CHAR\",\"a\"]]",
    "[\"char\",5,[\"CHAR\",\"d\"]]",
    "[\"char\",5,[\"CHAR\",\"e\"]]",
    "[\"char\",5,[\"CHAR\",\"k\"]]",
    "[\"char\",5,[\"CHAR\",\"m\"]]",
    "[\"char\",5,[\"CHAR\",\"n\"]]",
    "[\"char\",5,[\"CHAR\",\"o\"]]",